<?xml version="1.0" encoding="UTF-8"?>
<GME xmlns:xsi="http://www.w3.org/2001/XMLSchema-instance" xsi:noNamespaceSchemaLocation="xsd/configuration.xsd">
	<Configurations>
		<Configuration name="Project" root="Scenario" controller="RootController" linkType="Scenario"/>
		<Configuration name="VSG" root="Scenario" controller="VSG.Controllers.VSGController" linkType="Scenario"/>
	</Configurations>
	<Global>
		<Components>
			<Component name="Scenario" bitmap="Folder.ico">
				<CreateComponents>
					<CreateComponent component="Playfield" name="Playfield" configuration="VSG" eType="Component">
						<CreateLinks>
							<CreateLink name="Scenario" configuration="VSG" schemaRoot="Root" from="Parent" to="Self"/>
						</CreateLinks>
					</CreateComponent>
				</CreateComponents>
				<ComplexParameters>
					<Parameters>
						<Parameter propertyName="ScenarioName" type="System.String" displayedName="Scenario Name" value="" category="Scenario" description="Name of Scenario"/>
						<Parameter propertyName="Description" type="System.String" displayedName="Description" value="" category="Scenario" description="Description of scenario"/>
						<Parameter propertyName="TimeToAttack" type="System.Int32" displayedName="Time To Attack" value="10" category="Scenario" description="Time To Attack"/>
						<Parameter propertyName="AssetTransfer" type="System.Boolean" displayedName="Allow Asset Transfers" value="false" category="Scenario" description="Enables or disables the ability for Decision Makers to be able to transfer assets between each other."/>
						<Parameter propertyName="RangeRingDisplayType" type="RangeRingDisplayEnum" displayedName="Range Ring Display Type" value="Full" category="Scenario" description="Range Ring Client Display Value" />
					</Parameters>
					<Enums>
					<Enum enumName="RangeRingDisplayEnum">
						<Value>Full</Value>
						<Value>Shared Sensor Network</Value>
						<Value>Personal</Value>
						<Value>Disabled</Value>
						</Enum>
					</Enums>
				</ComplexParameters>
			</Component>
			<Component name="Playfield">
				<ComplexParameters>
					<Parameters>
						<Parameter propertyName="MapFileName" type="System.String" displayedName="Map Filename" value="" category="Playfield" description="Map Filename"/>
						<Parameter propertyName="IconLibrary" type="System.String" displayedName="Icon Library" value="" category="Playfield" description="Icon Library"/>
						<Parameter propertyName="UtmZone" type="System.String" displayedName="UTM Zone" value="None" category="Playfield" description="UTM Zone"/>
						<Parameter propertyName="VerticalScale" type="System.Decimal" displayedName="Vertical Scale" value="1.0" category="Playfield" description="Vertical Scale">
							<Constraints>
								<Constraint constraintName="min" constraintValue="0.001"/>
								<Constraint constraintName="max" constraintValue="5000"/>
							</Constraints>
						</Parameter>
						<Parameter propertyName="HorizontalScale" type="System.Decimal" displayedName="Horizontal Scale" value="1.0" category="Playfield" description="Horizontal Scale">
							<Constraints>
								<Constraint constraintName="min" constraintValue="0.001"/>
								<Constraint constraintName="max" constraintValue="5000"/>
							</Constraints>
						</Parameter>
						<Parameter propertyName="Northing" type="System.Decimal" displayedName="Northing" value="0.0" category="Playfield" description="Northing"/>
						<Parameter propertyName="Easting" type="System.Decimal" displayedName="Easting" value="0.0" category="Playfield" description="Easting"/>
						<Parameter propertyName="DefaultDisplayLabels" type="System.String" displayedName="Display Labels" value="" category="Playfield" description="If labels are displayed by default, or disabled"/>
						<Parameter propertyName="DefaultDisplayTags" type="System.String" displayedName="Display Tags" value="" category="Playfield" description="If tags are displayed by default, or disabled."/>
					</Parameters>
				</ComplexParameters>
			</Component>
			<Component name="LandRegion">
				<ComplexParameters>
					<Parameters>
						<Parameter propertyName="PolygonPoints" type="System.String" displayedName="Polygon Points" value="" category="Location" description="Location of the Land Region"/>
						<Parameter propertyName="Color" type="System.Drawing.Color, System.Drawing, Version=2.0.0.0, Culture=neutral, PublicKeyToken=b03f5f7f11d50a3a" displayedName="Color" value="Brown" category="Color" description="Color"/>
						<Parameter propertyName="Alpha" type="System.String" displayedName="Alpha" value="" category="Color" description="Alpha"/>
					</Parameters>
					<Enums>
						<Enum enumName="Colors">
							<Value>AliceBlue</Value>
							<Value>Aqua</Value>
							<Value>Blue</Value>
							<Value>BlueViolet</Value>
							<Value>Brown</Value>
							<Value>CornflowerBlue</Value>
							<Value>Crimson</Value>
							<Value>Cyan</Value>
							<Value>DarkBlue</Value>
							<Value>DarkGray</Value>
							<Value>DarkGreen</Value>
							<Value>DarkKhaki</Value>
							<Value>DarkOliveGreen</Value>
							<Value>DarkRed</Value>
							<Value>DarkSlateGray</Value>
							<Value>DodgerBlue</Value>
							<Value>Fuchsia</Value>
							<Value>Gray</Value>
							<Value>Green</Value>
							<Value>GreenYellow</Value>
							<Value>HotPink</Value>
							<Value>Khaki</Value>
							<Value>Lavender</Value>
							<Value>LimeGreen</Value>
							<Value>Magenta</Value>
							<Value>Maroon</Value>
							<Value>Navy</Value>
							<Value>Olive</Value>
							<Value>OliveDrab</Value>
							<Value>Orange</Value>
							<Value>OrangeRed</Value>
							<Value>Plum</Value>
							<Value>PowderBlue</Value>
							<Value>Purple</Value>
							<Value>Red</Value>
							<Value>RosyBrown</Value>
							<Value>RoyalBlue</Value>
							<Value>SandyBrown</Value>
							<Value>SeaGreen</Value>
							<Value>Silver</Value>
							<Value>SkyBlue</Value>
							<Value>SlateBlue</Value>
							<Value>SlateGray</Value>
							<Value>Tan</Value>
							<Value>Teal</Value>
							<Value>Transparent</Value>
							<Value>Turquoise</Value>
							<Value>Violet</Value>
							<Value>Yellow</Value>
							<Value>YellowGreen</Value>
						</Enum>
					</Enums>
				</ComplexParameters>
			</Component>
			<Component name="ActiveRegion">
				<ComplexParameters>
					<Parameters>
						<Parameter propertyName="PolygonPoints" type="System.String" displayedName="Polygon Points" value="" category="Location" description="Location of the Land Region"/>
						<Parameter propertyName="Color" type="System.Drawing.Color, System.Drawing, Version=2.0.0.0, Culture=neutral, PublicKeyToken=b03f5f7f11d50a3a" displayedName="Color" value="DarkGreen" category="Color" description="Color"/>
						<Parameter propertyName="Alpha" type="System.String" displayedName="Alpha" value="" category="Color" description="Alpha"/>
						<Parameter propertyName="Start" type="System.Decimal" displayedName="Start" value="0.0" category="Active Region" description="Start"/>
						<Parameter propertyName="End" type="System.Decimal" displayedName="End" value="0.0" category="Active Region" description="End"/>
						<Parameter propertyName="SpeedMultiplier" type="System.Decimal" displayedName="Speed Multiplier" value="1.0" category="Active Region" description="Speed Multiplier"/>
						<Parameter propertyName="BlocksMovement" type="System.Boolean" displayedName="Blocks Movement" value="false" category="Active Region" description="Blocks Movement"/>
						<Parameter propertyName="SensorsBlocked" type="System.String" displayedName="Sensors Blocked" value="" category="Active Region" description="Sensors Blocked"/>
						<Parameter propertyName="IsVisible" type="System.Boolean" displayedName="Is Visible" value="true" category="Active Region" description="Is Visible"/>
						<Parameter propertyName="ReferencePoint" type="System.String" displayedName="ReferencePoint" value="" category="Location" description="Reference point of the Active Region"/>
						
						<Parameter propertyName="IsDynamicRegion" type="System.Boolean" displayedName="Is this a Dynamic Region" value="false" category="Active Region" description="Is this object a dynamic region, tied to an instantiation of an object"/>
						<Parameter propertyName="RelativePolygonPoints" type="System.String" displayedName="Relative Polygon Points" value="" category="Location" description="Relative Location of the Active Region"/>
						
					</Parameters>
					<Enums>
						<Enum enumName="Colors">
							<Value>AliceBlue</Value>
							<Value>Aqua</Value>
							<Value>Blue</Value>
							<Value>BlueViolet</Value>
							<Value>Brown</Value>
							<Value>CornflowerBlue</Value>
							<Value>Crimson</Value>
							<Value>Cyan</Value>
							<Value>DarkBlue</Value>
							<Value>DarkGray</Value>
							<Value>DarkGreen</Value>
							<Value>DarkKhaki</Value>
							<Value>DarkOliveGreen</Value>
							<Value>DarkRed</Value>
							<Value>DarkSlateGray</Value>
							<Value>DodgerBlue</Value>
							<Value>Fuchsia</Value>
							<Value>Gray</Value>
							<Value>Green</Value>
							<Value>GreenYellow</Value>
							<Value>HotPink</Value>
							<Value>Khaki</Value>
							<Value>Lavender</Value>
							<Value>LimeGreen</Value>
							<Value>Magenta</Value>
							<Value>Maroon</Value>
							<Value>Navy</Value>
							<Value>Olive</Value>
							<Value>OliveDrab</Value>
							<Value>Orange</Value>
							<Value>OrangeRed</Value>
							<Value>Plum</Value>
							<Value>PowderBlue</Value>
							<Value>Purple</Value>
							<Value>Red</Value>
							<Value>RosyBrown</Value>
							<Value>RoyalBlue</Value>
							<Value>SandyBrown</Value>
							<Value>SeaGreen</Value>
							<Value>Silver</Value>
							<Value>SkyBlue</Value>
							<Value>SlateBlue</Value>
							<Value>SlateGray</Value>
							<Value>Tan</Value>
							<Value>Teal</Value>
							<Value>Transparent</Value>
							<Value>Turquoise</Value>
							<Value>Violet</Value>